{"activation_token_sha256":"d44eea5272a29e836de3cea42048e441aa4e5358de4b22ad878462c0fab2caef","ai_toolchain":{"models":{"planner":"test-v1"},"prompts":{"release":"sha256:test"},"tools":{"factory":"0.2.0"}},"bom_id":"previous-bom-001","compatibility_matrix_sha256":"bd961f9d02e3f22ce76d1174489fbe95316a0d32de7e6f338d940f9cdcb38d7a","contracts":[],"created_at":"2026-07-14T00:00:00Z","database_versions":{},"dependency_dag_sha256":"3f68c2dd982d10256b819d878f1926dd90233d93d6ed35573b4395dce7c87493","device_route_assignment_authorities":[{"activation_token_sha256":"d44eea5272a29e836de3cea42048e441aa4e5358de4b22ad878462c0fab2caef","auth_scope":"windows-edge-supervisor:device-route-assignment:issue","policy_id":"SOUL-ISO-001","producer_module":"factory-release-controller","release_bom_generation":1,"revoked":false,"rotation_epoch":6,"route_authority_id":"device-route-authority-a","route_authority_sha256":"50216dfd51ed41e7e600a604146d38b07b27753f66194f7ed3f8d047b80fa62f","route_signer_key_id":"p256_spki_4444444444444444444444444444444444444444444444444444444444444444","route_signer_p256_spki_sha256":"4444444444444444444444444444444444444444444444444444444444444444","signature_algorithm":"ECDSA_P256_SHA256","signature_format":"IEEE_P1363_FIXED_FIELD_LOW_S","supervisor_artifact_id":"dps.windows-edge-supervisor","supervisor_artifact_sha256":"b93f7a30b7c56dd6a48ffbe8b21f2531280eda252e1ae5a75570cef13c7ad83c","supervisor_generation":8,"supervisor_instance_id":"si_22222222222222222222222222222222","supervisor_module_id":"windows-edge-supervisor","supervisor_version":"1.0.0","valid_from":"2026-07-01T00:00:00.0000002Z","valid_until":"2026-07-31T00:00:00.0000002Z"}],"evidence":[{"artifact_uri":"evidence/gate-integration-001.json","evidence_id":"gate-integration-001","issuer_identity":"evidence-issuer","kind":"INTEGRATION","required":true,"result":"PASS","sha256":"f239352333af0f504dd7c28834e4d2626f76fa749ba425d49521c653975c0b3b","signature":{"algorithm":"rsa-pss-sha256","key_id":"evidence-key","value":"O8fdxtQh0t0wooLH0JVIybGRxQz2+5gD50ZnTZLVqikDrLlzR92siH2jndiDU9heUSuePf9Q69OI7xGFQIM9AQmJjFYo6EDozPqZXcb0jNG2AMjYCgskNKZF5dBXbco1PzySRVC9AgtrKa1u7DMI4E7UnSjrCuMb/LEcPWcVr0Q="},"tested_commit":"37c167e44b62dd462bdc993152e2405607744a83","verification_level":"INTEGRATION_VERIFIED"}],"feature_flags":{"runtime_authority_v1":false},"instruction_hashes":[{"path":"AGENTS.md","sha256":"4d4f2e573be08d6f7a22d7f13d084a5242c2ebc4814774e95fba3dfdb74369a4"},{"path":"Modules/policy-approval/AGENTS.md","sha256":"1d8856e1871731194e60ea4918de6c75083564b8ca7533cea5add1122bbd09c4"},{"path":"Modules/windows-edge-supervisor/AGENTS.md","sha256":"cdf8f2a457007d81739e6fbb8ff34903a8dcf46e9cb5e317b259680b51ce02f2"},{"path":"Modules/windows-edge-worker/AGENTS.md","sha256":"d8d406b0a72e313ee40eaef93755f47aa99e4ffa6a1779c6d7b98ae95e0e9f66"}],"integration_commit":"37c167e44b62dd462bdc993152e2405607744a83","kill_switches":{"native_stop":true},"modules":[{"agents_sha256":"1d8856e1871731194e60ea4918de6c75083564b8ca7533cea5add1122bbd09c4","artifact_uri":"artifacts/policy-approval.bin","descriptor_sha256":"8b2bebd75c109bb2c99e0d3a17e98952e77fc02182439a44da52aa010c011475","descriptor_uri":"metadata/policy-approval.descriptor.json","manifest_sha256":"6fdeb82c7d4d17187b8e5cc8732883239f748c0857c0d8ddce5fa8d00ebbde72","module_id":"policy-approval","provenance_sha256":"2d5dc6da8bd517313c5fe4fc74dbc47caa6f9040ddb42f869cb544b4a26647f3","provenance_uri":"metadata/policy-approval.provenance.json","sbom_sha256":"320151ac564c51092b188aaef8b40aa3d1d86b41c3892063f98eb183ac1e16a5","sbom_uri":"metadata/policy-approval.spdx.json","sha256":"72453a0a3c32fb600c8b5a75c8f6a3c445f9f1d6f0406bd291af2e7b443a0791","signature":{"algorithm":"rsa-pss-sha256","key_id":"controller-key","value":"y7TsemdD4w2D8lFnzISh5wZSpRT3KaDYCK+Qkq7tZsHfTafv1YL4oBUi1XMeL0uP3ne+1/f4I1QB+FcNqawwNKTQi9RCAXuQ8TbcSiFfnkRREU1UWb1aHZiuomCdPMj2oUXqvpO37cveKMFkeqQ/6+Y4IDpCgI0aCaAyw93F/5I="},"version":"1.0.0"},{"agents_sha256":"cdf8f2a457007d81739e6fbb8ff34903a8dcf46e9cb5e317b259680b51ce02f2","artifact_uri":"artifacts/windows-edge-supervisor.bin","descriptor_sha256":"a2bf2fa5b57c4ed2a63a3a1ed4e94ba29d149a3d2fbf533704d255d1e22e9564","descriptor_uri":"metadata/windows-edge-supervisor.descriptor.json","manifest_sha256":"bee5bb4dab3be1a88d9bf617ac40b76b65226df74c47c29c94f9e3a863b00d64","module_id":"windows-edge-supervisor","provenance_sha256":"4ed204d6c5c3956e17ecf20730d3ef224d478bf8ad65c6b034f0b91d3e9a2f97","provenance_uri":"metadata/windows-edge-supervisor.provenance.json","sbom_sha256":"247bd7763656c3cfab50148705b8eea5b4d0ded028ca5ce868b7021976a5a679","sbom_uri":"metadata/windows-edge-supervisor.spdx.json","sha256":"b93f7a30b7c56dd6a48ffbe8b21f2531280eda252e1ae5a75570cef13c7ad83c","signature":{"algorithm":"rsa-pss-sha256","key_id":"controller-key","value":"clh62+8GsqRspR0CfKP/BMF1viJ3AvIldVEI0xkfgsORuAAwFpMDB673MRRXxkub0fcvEtmw2fh8pOsYmK49qYuLXHE5TNLbRzvmx321oHiDoaPCDrit7Koto+PGYasN0/h/Hc3CQJe8bnDGh0KH+GDn6o+R66GrMjRUKs3VfjQ="},"version":"1.0.0"},{"agents_sha256":"d8d406b0a72e313ee40eaef93755f47aa99e4ffa6a1779c6d7b98ae95e0e9f66","artifact_uri":"artifacts/windows-edge-worker.bin","descriptor_sha256":"46f0e62fbe41979df88528b48cf4a24c54e4f7b1dc7d631407d98faead118eda","descriptor_uri":"metadata/windows-edge-worker.descriptor.json","manifest_sha256":"0eb3b5c506ca6de3b942e1aedf67988096e57a0aa9522ab7ffc907588af31299","module_id":"windows-edge-worker","provenance_sha256":"af271462758c1cdabcd3af5c99ef26dc64e6fd7d905a0f49b25ac98c4441d124","provenance_uri":"metadata/windows-edge-worker.provenance.json","sbom_sha256":"83e162ddb4e8c2185f92e048a2d3e0948e12ac605534b4d00a60db43a5be135d","sbom_uri":"metadata/windows-edge-worker.spdx.json","sha256":"359051ff483e0d5b57b4c327e9b7a2348254f82c5d6f72bbea9802760c64e3a3","signature":{"algorithm":"rsa-pss-sha256","key_id":"controller-key","value":"UjGkOxQm3AT8YiEaTcdJQh1ed3EQQOYnGqDjoUbEnsgvOKdOXNNvHJo9LVvDbrv537t3NCWWfMbQbwlVQHbNQk9x2M52kiEgavd3lJQHU0voboFWeOiII8bau15eZ6fzw6Affv9znczpvsC6rO+c5rivBaypjg1lAqkJFm0Mahs="},"version":"1.0.0"}],"native_stop_authorities":[{"activation_token_sha256":"d44eea5272a29e836de3cea42048e441aa4e5358de4b22ad878462c0fab2caef","auth_scope":"policy-approval:native-stop-proof:v2:commit-unknown","authority_id":"native-stop-authority-a","key_id":"worker-native-stop-key-a","native_stop_contract_id":"native.stop.proof/v2","p256_spki_sha256":"3333333333333333333333333333333333333333333333333333333333333333","policy_id":"RESULT-VERIFY-001","producer_module":"windows-edge-worker","release_bom_generation":1,"revoked":false,"rotation_epoch":5,"signature_algorithm":"ECDSA_P256_SHA256","signature_format":"IEEE_P1363_FIXED_FIELD","valid_from":"2026-07-01T00:00:00.0000001Z","valid_until":"2026-07-31T00:00:00.0000001Z","worker_artifact_id":"dps.windows-edge-worker","worker_artifact_sha256":"359051ff483e0d5b57b4c327e9b7a2348254f82c5d6f72bbea9802760c64e3a3","worker_authority_sha256":"f644e0ef313bbdd11e07c6f766b38f387c2050bd306de22708be13dfacb380a0","worker_generation":7,"worker_instance_id":"wi_11111111111111111111111111111111","worker_module_id":"windows-edge-worker","worker_slot":"A","worker_version":"1.0.0"}],"native_stop_challenge_authorities":[{"activation_token_sha256":"d44eea5272a29e836de3cea42048e441aa4e5358de4b22ad878462c0fab2caef","auth_scope":"policy-approval:native-stop-challenge:v1:issue","authority_id":"native-stop-challenge-authority-a","challenge_authority_sha256":"1bd8a3317cc860bcb2a97282ec71aadc911cf822b809e2e490d422636387bbdf","key_id":"policy-challenge-key-a","native_stop_challenge_contract_id":"native.stop.challenge/v1","p256_spki_sha256":"5555555555555555555555555555555555555555555555555555555555555555","policy_artifact_id":"dps.policy-approval","policy_artifact_sha256":"72453a0a3c32fb600c8b5a75c8f6a3c445f9f1d6f0406bd291af2e7b443a0791","policy_generation":9,"policy_id":"NATIVE-STOP-CHALLENGE-001","policy_instance_id":"pi_33333333333333333333333333333333","policy_module_id":"policy-approval","policy_version":"1.0.0","producer_module":"policy-approval","release_bom_generation":1,"revoked":false,"rotation_epoch":7,"signature_algorithm":"ECDSA_P256_SHA256","signature_format":"IEEE_P1363_FIXED_FIELD_LOW_S","valid_from":"2026-07-01T00:00:00.0000003Z","valid_until":"2026-07-31T00:00:00.0000003Z"}],"previous_stable_bom":null,"previous_stable_bom_sha256":null,"release_approval":{"approver_identity":"human-approver","approver_role":"human-release-approver","receipt_uri":"approvals/approval-001.json","required":true,"sha256":"1503554ba487ca77b22410ee6cb7d8848cd3d1c28e715f712e95dabeea047767","signature":{"algorithm":"rsa-pss-sha256","key_id":"approval-key","value":"fJ+l//pgVJc+pm2oSmbmT7+2QtW9Uq+zgZs+21HPlfaH3oNuf9375407f6K6MSxGq8PN0tcmElsLfAVM5B10A/ARW6Sc6p1JHwIRIhKqVpU6cZ1YnBGuQtF/HMXYVPZ8XSw51LwiLyDMGFljO3FAfpj0XF/i64+Z+Ot8N4NvjPY="}},"release_bom_generation":1,"risk":{"requested_by":"module-builder","scope_sha256":"05131bbbf96abaa956b470aeb8bbeececec2a0636032c37d1ee2f796ac05b1d9","tier":"R3"},"rollback":{"compensation_required":false,"procedure":"stop-drain-switch-verify","target_minutes":5,"unit":"runtime-authority-group"},"rollout":{"current_wave":"not-started","shadow_artifact_sha256":"3660e8b9824c8cedffd30733fd5b3a28b69c5e4f411c44ae551b68c9a8ff2268","waves":["shadow","1"]},"schema_version":"dps.release-bom/v1","signature":{"algorithm":"rsa-pss-sha256","key_id":"r0c-compat-external-bom-key-v1","value":"mJF0r+xmfmeWr6XBlF14lz9CXGjV+Ph17xYaZoW959UO6Nf+MS8jQ/6/EVLIjMgbl7/2kDKHX9mva/JarJieVIuj9rInZsa47/9UMw0+MBFRo8xvhrQ6uLFjJzXGHbOzkUPLGYU8lIusr9oDsfiaOE4ZV5T9mMUfXqqanuEX7bS/aSsSrDmd8m+xgQVBIxL0bZLHMCJp+7smCtO9szZYEI+1c+A9jvkepGWIXeTMtt4GNDZCsx7iKdIq8WIUhionDno8gpf66ez4vtE8VEER61CN91Env2yd4RjTq8Zz46wy5VSDTv/eXHFtyb5Uc7kF+wNTEJG6ablB35zdyP1B9A=="},"status":"SIGNED"}